contract_number,procurement_unique_id,title,directorate,contract_type,slj_initiative,status,execution_date,expiry_date,amount,suppliers,details_url,has_attachments
PICH0008663,PICH0008663,Service Level Agreement for Existing Imaging Systems - Canberra Health Services,Canberra Health Services,Contract,No,Current,2025-05-21,2026-05-20,798682.5,Siemens Healthineers,https://www.tenders.act.gov.au/contract/view?id=223377,False
PICI0005171.a,PICI0005171,Provision of Learning Resources for CIT Accounting,Canberra Institute of Technology,Contract,No,Current,2025-05-20,2028-05-19,220000.0,Learn Now Publications Pty Ltd,https://www.tenders.act.gov.au/contract/view?id=223786,False
PISL0003149,PISL0003149,North Wright Compact Housing Project Stage 2,Suburban Land Agency,Contract,Yes,Current,2025-05-20,2026-02-20,712296.2,Belford Building & Construction Pty Ltd,https://www.tenders.act.gov.au/contract/view?id=223480,False
PIIN0008622,PIIN0008622,Audio Visual System Upgrade and Support,ACT Integrity Commission,Contract,Yes,Current,2025-05-20,2028-09-30,182511.89,Intravision Pty Limited,https://www.tenders.act.gov.au/contract/view?id=223681,False
2025.0008745,2025.0008745,Vehicle Lease Agreement,"Environment, Planning and Sustainable Development Directorate",Contract,No,Current,2025-05-19,2026-11-30,129360.0,Hyundai Motor Company Australia Pty Ltd,https://www.tenders.act.gov.au/contract/view?id=223963,False
PICI0006306,PICI0006306,Provision of Australian and International Standards,Canberra Institute of Technology,Contract,No,Current,2025-05-19,2027-06-11,87950.15,Sai Global Australia Pty Ltd,https://www.tenders.act.gov.au/contract/view?id=223262,False
PICR0007926,PICR0007926,"DEVELOPMENT PLAN BLOCK 1, SECTION 116, CITY",City Renewal Authority,Contract,No,Current,2025-05-16,2026-02-27,491507.0,Architectus Australia Pty Ltd,https://www.tenders.act.gov.au/contract/view?id=223346,False
HM-20914-DAT,PIED0007529,Hardware Marketplace Contract - End User Computing - Chromebooks - Datacom,Education Directorate,Contract,No,Current,2025-05-16,2028-05-17,1432500.0,Datacom Systems (AU),https://www.tenders.act.gov.au/contract/view?id=223263,False
PICR0008185,PICR0008185,"Market and Commercial Advisory for Block 1 Section 116, City",City Renewal Authority,Contract,No,Current,2025-05-15,2026-03-11,132000.0,JONES LANG LASALLE ADVISORY SERVICES PTY LTD,https://www.tenders.act.gov.au/contract/view?id=223345,False
PICI0008019.a,PICI0008019,PICI0008019.a TM1 Maintenance and Support: Budget Management System (BMS),Canberra Institute of Technology,Contract,No,Current,2025-05-15,2028-05-14,140000.0,Excelerated Consulting Pty Ltd,https://www.tenders.act.gov.au/contract/view?id=223265,False
PICI0005171.b,PICI0005171,Provision of Learning Resources for CIT Accounting,Canberra Institute of Technology,Contract,No,Current,2025-05-15,2028-05-14,45000.0,The Trustee for Maguire Printing Trust,https://www.tenders.act.gov.au/contract/view?id=223787,False
HM-21133-RIT,PICM0008456,Brokerage Services - ICT Equipment Disposal,"Chief Minister, Treasury and Economic Development Directorate",Contract,No,Current,2025-05-15,2028-05-14,0.0,Falzon Pty Limited trading as Reuse Recycle IT,https://www.tenders.act.gov.au/contract/view?id=223204,False
PISL0001954,PISL0001954,Bandler Master Plan Consultancy,Suburban Land Agency,Contract,No,Current,2025-05-15,2026-05-05,736995.12,Hatch Pty Ltd,https://www.tenders.act.gov.au/contract/view?id=223323,False
58237-NCT-108,PIMA0006744,Electrification Of Gas Assets Engineering Services FY 24-25,ACT Government,Contract,No,Current,2025-05-22,2026-03-31,144320.0,Northrop Consulting Engineers Pty Ltd,https://www.tenders.act.gov.au/contract/view?id=223293,False
PICH0004882,PICH0004882,Placement Agreement- Ultrasonic tissue dissection device and associated consumables,Canberra Health Services,Contract,No,Current,2025-05-12,2026-05-11,109525.9,Johnson & Johnson Medical Pty Ltd,https://www.tenders.act.gov.au/contract/view?id=225223,False
PITC0008284,PITC0008284,Sweeper and Scrubber Machines For Woden Bus Depot,Transport Canberra and City Services,Contract,No,Current,2025-05-12,2026-05-12,98861.4,Australian Sweeper Corporation Pty Ltd,https://www.tenders.act.gov.au/contract/view?id=223289,False
PO_15413,PIED0007072,Caroline Chisholm High School - Year 7 Overnight Excursion 2025-2027,Education Directorate,Contract,No,Current,2025-05-12,2027-12-31,112508.77,Tyler and Kiah Pty Ltd T/as Camp Kianinny,https://www.tenders.act.gov.au/contract/view?id=218753,False
PIHD0008302,PIHD0008302,ACT component of the 2025 Australian Secondary Students' Alcohol and Drug survey,ACT Health Directorate,Contract,No,Current,2025-05-12,2026-06-30,77000.0,Cancer Council Victoria,https://www.tenders.act.gov.au/contract/view?id=223495,False
PIEP0008154-2,PIEP0008154,Retail Needs Assessment Richardson Local Centre,"Environment, Planning and Sustainable Development Directorate",Contract,No,Current,2025-05-09,2026-01-30,29150.0,Urban Enterprise Pty Ltd,https://www.tenders.act.gov.au/contract/view?id=223026,False
PIED0009125,PIED0009125,Theodore Primary School - Year 5/6 Overnight Camp 2026,Education Directorate,Contract,No,Current,2025-05-07,2026-12-31,29040.0,Away We Go Tours Pty Ltd,https://www.tenders.act.gov.au/contract/view?id=223118,False
PICF0009041,PICF0009041,Website Development Support,Cultural Facilities Corporation,Contract,No,Current,2025-05-07,2026-05-01,90288.0,GIRAFFE VISUAL COMMUNICATION MANAGEMENT PTY LTD,https://www.tenders.act.gov.au/contract/view?id=223106,False
PO_18052,PIED0007528,Dickson College - Year 11 and 12 Ski Trip 2025-2027,Education Directorate,Contract,No,Current,2025-05-07,2027-12-31,169999.56,Absolute Travel,https://www.tenders.act.gov.au/contract/view?id=223121,False
PICH0008369,,Contract for Purchase of Slave Monitor and Foot Pedal for ARTIS lcono Bi Plane IR,Canberra Health Services,Contract,No,Current,2025-05-07,2026-05-06,35200.0,Siemens Healthineers,https://www.tenders.act.gov.au/contract/view?id=223267,False
PIJC0001803,PIJC0001803,Provision of Fire Service Systems Maintenance at the Alexander Maconochie Centre (AMC),Justice and Community Safety Directorate,Contract,Yes,Current,2025-05-05,2028-05-04,995000.0,360 Degree Fire Pty Ltd,https://www.tenders.act.gov.au/contract/view?id=222955,False
PIEP0007062.05,PIEP0007062.05,Preliminary Infrastructure Requirements for the Belconnen Town Centre and Surrounds Change Areas,"Environment, Planning and Sustainable Development Directorate",Contract,No,Current,2025-05-05,2026-05-05,127345.9,Egis Consulting Pty Ltd,https://www.tenders.act.gov.au/contract/view?id=222835,False
PIJC0002732,PIJC0002732,Ambulance Chassis across the ACT Emergency Services Agency,Justice and Community Safety Directorate,Contract,No,Current,2025-05-05,2030-05-04,5196491.0,Mercedes-Benz Australia / Pacific Pty Ltd,https://www.tenders.act.gov.au/contract/view?id=223030,False
PIEP0002318,PIEP0002318,Belconnen Infrastructure Capacity Study,"Environment, Planning and Sustainable Development Directorate",Contract,No,Current,2025-05-02,2026-04-28,214920.75,"Egis Consulting
EGIS Consulting Pty Ltd",https://www.tenders.act.gov.au/contract/view?id=222852,False
PICI0008120,PICI0008120,Provision of Electronic Access Control system and products and Services,Canberra Institute of Technology,Contract,No,Current,2025-05-02,2026-05-01,195939.11,Unicard systems Pty Ltd,https://www.tenders.act.gov.au/contract/view?id=225495,False
PIHD0007098,PIHD0007098,Connecting with People Suicide Prevention Training,ACT Health Directorate,Contract,Yes,Current,2025-04-23,2026-04-23,45000.0,4 Mental Health Ltd United Kingdom,https://www.tenders.act.gov.au/contract/view?id=223165,False
PITC0007687,PITC0007687,Streams Software Assurance and Managed Services,Transport Canberra and City Services,Contract,No,Current,2025-04-30,2026-10-31,1114930.5,Transmax Pty Ltd,https://www.tenders.act.gov.au/contract/view?id=223194,False
HM-20741-DT3,PICM0003960,Cisco Hardware Support and Maintenance,"Chief Minister, Treasury and Economic Development Directorate",Contract,No,Current,2025-04-16,2030-05-01,4269269.58,Data#3,https://www.tenders.act.gov.au/contract/view?id=222594,False
PIJC0002823,PIJC0002823,Mt Ainslie Site licence,ACT Government,Contract,No,Current,2025-07-02,2028-04-30,144128.0,Canberra Airport Pty Limited,https://www.tenders.act.gov.au/contract/view?id=226136,False
PICH0009235,,Service Agreement for Medrad Contrast Injectors for Canberra Health Services (CHS),Canberra Health Services,Contract,No,Current,2025-08-08,2030-04-30,483639.51,Imaxeon Pty Ltd,https://www.tenders.act.gov.au/contract/view?id=227242,False
PICR0007702,PICR0007702,Quarterly media insights reporting,City Renewal Authority,Contract,No,Current,2025-04-30,2027-03-31,46200.0,Streem PTY,https://www.tenders.act.gov.au/contract/view?id=223303,False
PIEP0008283,PIEP0008283,Leaf Cages for ACT Schools,"Environment, Planning and Sustainable Development Directorate",Contract,No,Current,2025-04-30,2026-06-30,108333.0,THE METAL SHOP,https://www.tenders.act.gov.au/contract/view?id=222813,False
PITC0009053,PITC0009053,35 Ground Moisture Sensors Urban Parks,Transport Canberra and City Services,Contract,No,Current,2025-04-30,2026-04-29,61721.0,Living Turf,https://www.tenders.act.gov.au/contract/view?id=222798,False
PITG0007697,PITG0007697,Tax Compliance and Advisory Services,Justice and Community Safety Directorate,Contract,No,Current,2025-04-29,2026-06-28,500000.0,MGI Joyce|Dickson,https://www.tenders.act.gov.au/contract/view?id=223027,False
C050605,PIEP0008379,Urban heat mapping and urban heat island index development,ACT Government,Contract,No,Current,2025-04-29,2026-08-31,161082.9,CSIRO,https://www.tenders.act.gov.au/contract/view?id=222841,False
PICR0008805,PICR0008805,City Precinct Sentiment Survey,City Renewal Authority,Contract,No,Current,2025-04-29,2026-04-28,96035.5,ORIMA Research Pty Ltd,https://www.tenders.act.gov.au/contract/view?id=223484,False
PICM0008173,PICM0008173,Nominal Defendant Fund Actuarial Services,"Chief Minister, Treasury and Economic Development Directorate",Contract,No,Current,2025-04-28,2026-10-31,165550.0,Ernst & Young,https://www.tenders.act.gov.au/contract/view?id=223003,False
PICH0004173,,North Canberra Hospital – Generator Replacement Project,Canberra Health Services,Contract,No,Current,2025-04-23,2026-04-22,8651684.54,Shaw Building Group,https://www.tenders.act.gov.au/contract/view?id=223314,False
PO480275,PITC0009168,YN_Tube_2025-01 - Greenhills Propagation Nursery,Transport Canberra and City Services,Contract,No,Current,2025-04-22,2026-06-30,29301.19,Greenhills Propagation Nursery Pty Ltd,https://www.tenders.act.gov.au/contract/view?id=223049,False
PO479468/PO479482,PITC0009169,YN_Tube_2025-02 - Mansfields Propagation Nursery,Transport Canberra and City Services,Contract,No,Current,2025-04-22,2026-06-30,34136.04,Mansfield's Propagation Nursery Pty Ltd,https://www.tenders.act.gov.au/contract/view?id=223050,False
CLR-N2300-PANEL.093,,Canberra Light Rail Specialist Advisors Panel,ACT Government,"Panel Contract
(CLR-N2300-PANEL)",No,Current,2025-04-17,2027-07-29,0.0,Architectus Australia Pty Ltd,https://www.tenders.act.gov.au/contract/view?id=222511,False
PIJC0007585,PIJC0007585,"Goods and Services for the Supply, Support and Maintenance of Portable Radios",Justice and Community Safety Directorate,Contract,No,Current,2025-04-16,2027-04-15,0.0,L3HARRIS COMMUNICATIONS AUSTRALIA PTY LTD,https://www.tenders.act.gov.au/contract/view?id=222895,False
PICH0003939,,Superficial/Orthovoltage Radiation Therapy System,Canberra Health Services,Contract,No,Current,2025-04-16,2026-12-01,483236.6,Oxford scientific,https://www.tenders.act.gov.au/contract/view?id=222887,False
PICH0001533,PICH0001533,ORAL HEALTH SERVICES IMAGING DEVICES FOR CANBERRA HEALTH SERVICES,Canberra Health Services,Contract,Yes,Current,2025-04-16,2035-04-15,799436.74,AUSTRALIAN IMAGING PTY LTD,https://www.tenders.act.gov.au/contract/view?id=222496,False
PIJC0002145,PIJC0002145,Provision of Pest Control Services to ACT Corrective Services (ACTCS) Alexander Maconochie Centre (AMC) and Symonston Periodic Detention Centre (SPDC),Justice and Community Safety Directorate,Contract,Yes,Current,2025-04-16,2028-04-15,210375.0,Rentokil Initial Pty Ltd,https://www.tenders.act.gov.au/contract/view?id=222613,False
PIED0006417,PIED0006417,Delivery of ACT Early Childhood Education and Care (ECEC) Professional Learning Network (Network) Project.,Education Directorate,Contract,Yes,Current,2025-04-16,2028-06-30,220000.0,ELM (ACT),https://www.tenders.act.gov.au/contract/view?id=224504,False
PITC0007380,PITC0007380,Ground Maintenance Services for Transport Canberra Bus Depots,Transport Canberra and City Services,Contract,No,Current,2025-04-15,2027-04-14,117600.0,"LEAD - Live, Experience Access and Develop",https://www.tenders.act.gov.au/contract/view?id=222633,False
PIED0006905,PIED0006905,Lanyon High School – Door and Gate modifications,Education Directorate,Contract,Yes,Current,2025-04-11,2026-04-29,121109.23,MBS FM Pty Ltd,https://www.tenders.act.gov.au/contract/view?id=222704,False
PIHD0002370,PIHD0002370,CCURE SSA LICENCE,ACT Health Directorate,Contract,No,Current,2025-04-11,2026-09-29,545758.95,F S SOLUTIONS (ACT) PTY LTD,https://www.tenders.act.gov.au/contract/view?id=223202,False
CLR-N2300-PANEL.067,,Canberra Light Rail Specialist Advisors Panel -,ACT Government,"Panel Contract
(CLR-N2300-PANEL)",No,Current,2025-04-10,2027-07-29,27698.0,Geosyntec Consultants Pty Ltd,https://www.tenders.act.gov.au/contract/view?id=222371,False
PICM0007436,PICM0007436,2025 ACTPS Graduate Program - Learning and Development Modules,"Chief Minister, Treasury and Economic Development Directorate",Contract,Yes,Current,2025-04-09,2026-04-09,191070.0,Best Practicing Consulting Pty Ltd,https://www.tenders.act.gov.au/contract/view?id=222590,False
PICM0005820,PICM0005820,Investment Consulting Services,"Chief Minister, Treasury and Economic Development Directorate",Contract,No,Current,2025-04-09,2030-04-08,3300000.0,JANA Investment Advisers,https://www.tenders.act.gov.au/contract/view?id=222493,False
PIJC0007808,PIJC0007808,People Management (Skill-Development) Training,Justice and Community Safety Directorate,Contract,No,Current,2025-04-09,2027-04-08,195000.0,Alta Pete Pty Limited,https://www.tenders.act.gov.au/contract/view?id=222345,False
PIJC0007605,PIJC0007605,"Provision of Partner Support for ACT Corrective Services (ACTCS) Explore, Question, Understand, Investigate, Practice, Succeed Domestic and Family Violence Program",Justice and Community Safety Directorate,Contract,No,Current,2025-04-09,2026-04-08,90000.0,YWCA Canberra,https://www.tenders.act.gov.au/contract/view?id=222357,False
PO_06460,PIED0008385,Garran Primary School Year 6 Overnight Excursion 2026-2028,Education Directorate,Contract,Yes,Current,2025-04-09,2028-12-31,176220.0,Kianinny Bush Cabins,https://www.tenders.act.gov.au/contract/view?id=222492,False
27701-NCT-001-21,PIMA0003729,Managing Contractor Panel,ACT Government,"Panel Contract
(27701-NCT-001)",Yes,Current,2025-04-08,2028-09-30,0.0,JWLAND CONSTRUCTION PTY LTD,https://www.tenders.act.gov.au/contract/view?id=222290,False
PIEP0008621,PIEP0008621,Molonglo Valley restoration site stock fences,"Environment, Planning and Sustainable Development Directorate",Contract,Yes,Current,2025-04-07,2027-04-16,198000.0,Territory Agistment Pty Ltd,https://www.tenders.act.gov.au/contract/view?id=222365,False
PIEP0006786,PIEP0006786,Sullivans Creek Flood Study,"Environment, Planning and Sustainable Development Directorate",Contract,No,Current,2025-04-04,2026-01-30,120824.0,Stantec Australia Pty Ltd,https://www.tenders.act.gov.au/contract/view?id=222596,False
PIJC0001130,PIJC0001130,"Design, Manufacture and Supply of a Bariatric Ambulance for the ACT Emergency Services Agency and Associated Services",Justice and Community Safety Directorate,Contract,No,Current,2025-04-04,2030-04-03,505666.8,Mader International Pty Ltd,https://www.tenders.act.gov.au/contract/view?id=222338,False
PIJC0007583,PIJC0007583,Territory Radio Network Microwave Ring Replacement for the ACT Emergency Services Agency,Justice and Community Safety Directorate,Contract,No,Current,2025-04-03,2027-04-02,608943.72,SAT PTY LTD,https://www.tenders.act.gov.au/contract/view?id=222875,False
PISL00004198,PISL00004198,PISL00004198 Suburban Land Agency Board Audit and Risk Independent Member,Suburban Land Agency,Contract,No,Current,2025-04-03,2026-04-03,99000.0,Spark Integrity Pty Ltd,https://www.tenders.act.gov.au/contract/view?id=222604,False
HM-21071-DAT,​PICM0005830​,AV Equipment for Public Trustee Group,"Chief Minister, Treasury and Economic Development Directorate",Contract,Yes,Current,2025-04-03,2026-04-02,47363.8,Datacom,https://www.tenders.act.gov.au/contract/view?id=222294,False
PO_08856,,Aranda Primary School - Year 6 Overnight Excursion 2026,Education Directorate,Contract,No,Current,2025-04-03,2026-12-31,41360.0,TYLER AND KIAH PTY LTD,https://www.tenders.act.gov.au/contract/view?id=225202,False
PICM0002486,PICM0002486,Provision of ClickView Digital Media Software for the ACT Education Directorate,Education Directorate,Contract,No,Current,2025-04-01,2028-03-31,1721462.33,ClickView Australia Pty Limited,https://www.tenders.act.gov.au/contract/view?id=222350,False
PITC0006837,PITC0006837,Heating and Cooling Upgrades for Transport Canberra Buses,Transport Canberra and City Services,Contract,No,Current,2025-04-01,2026-03-31,533042.27,QTK Group PTY LTD,https://www.tenders.act.gov.au/contract/view?id=222645,False
PO13216,PIED0008662,Lake Tuggeranong College Leadership Program,Education Directorate,Contract,No,Current,2025-04-01,2026-04-01,66000.0,Leading Teams,https://www.tenders.act.gov.au/contract/view?id=222306,False
PITC0008225,PITC0008225,Management of Bus Advertising for Transport Canberra,Transport Canberra and City Services,Contract,No,Current,2025-03-26,2028-03-31,0.0,Go Transit Australia,https://www.tenders.act.gov.au/contract/view?id=222284,False
H2541985,,Stock catalogued product CUP PAPER HOT/COLD RIPPLE,Canberra Health Services,Contract,No,Current,2025-04-01,2026-03-31,26037.0,THE TRUSTEE FOR ONE STOP SUPPLY SHOP FAMILY TRUST,https://www.tenders.act.gov.au/contract/view?id=222370,False
2018.29874.119,,Mechanical Services and Maintenance – Package 1,Canberra Health Services,"Panel Contract
(2018.29874)",Yes,Current,2025-04-07,2030-03-31,7134419.39,Benmax Pty Ltd,https://www.tenders.act.gov.au/contract/view?id=222409,False
2025.PICS0005861,PICS0005861,Autism Spectrum Disorder Diagnostic Assessment via a Telehealth Platform,Community Services Directorate,Contract,No,Current,2025-04-01,2027-03-31,450000.0,Autism Spectrum Australia (ASPECT),https://www.tenders.act.gov.au/contract/view?id=222406,False
CLR-N2300-PANEL.092,,Canberra Light Rail Specialist Advisors Panel,Infrastructure Canberra,"Panel Contract
(CLR-N2300-PANEL)",No,Current,2025-04-01,2027-07-29,0.0,Croi Pty Ltd,https://www.tenders.act.gov.au/contract/view?id=222262,False
CLR-N2300-PANEL.084,,Canberra Light Rail Specialist Advisors Panel,Infrastructure Canberra,"Panel Contract
(CLR-N2300-PANEL)",No,Current,2025-04-01,2027-07-29,0.0,SGT-Consult Pty Ltd,https://www.tenders.act.gov.au/contract/view?id=222261,False
PIHD0008313,PIHD0008313,RightFax Support for 2025 - 2026,ACT Health Directorate,Contract,No,Current,2025-03-31,2026-03-31,25833.5,Axient Pty Ltd,https://www.tenders.act.gov.au/contract/view?id=223015,False
PICI0005994,PICI0005994,Provision of Online Tutoring Services,Canberra Institute of Technology,Contract,No,Current,2025-04-01,2027-03-31,121979.0,STUDIOSITY PTY LIMITED,https://www.tenders.act.gov.au/contract/view?id=225492,False
H2541743,,Warehouse catalogued stock goods,Canberra Health Services,Contract,No,Current,2025-03-31,2026-03-30,39303.8,Paragon Care Australia,https://www.tenders.act.gov.au/contract/view?id=222367,False
HM-20322-DT3,PICM0007415,Infoblox Support and Maintenance 2025,"Chief Minister, Treasury and Economic Development Directorate",Contract,No,Current,2025-01-20,2026-03-30,140491.26,Data#3 Limited,https://www.tenders.act.gov.au/contract/view?id=220814,False
H2541774,,Warehouse catalogued stock goods,Canberra Health Services,Contract,No,Current,2025-03-31,2026-03-30,25536.6,DHL EXEL SUPPLY CHAIN (AUSTRALIA) PTY LTD,https://www.tenders.act.gov.au/contract/view?id=222368,False
SM-08680-MCW,PICM0007799,Articulate 360 Licence Renewal,"Chief Minister, Treasury and Economic Development Directorate",Contract,No,Current,2025-03-23,2026-03-22,138144.7,The Trustee for the David Looke Family Trust,https://www.tenders.act.gov.au/contract/view?id=222201,False
H2541620,,Warehouse catalogued stock goods,Canberra Health Services,Contract,No,Current,2025-03-28,2026-03-27,38329.06,ITL Australia Pty Ltd,https://www.tenders.act.gov.au/contract/view?id=222349,False
H2541558,,Warehouse catalogued stock goods,Canberra Health Services,Contract,No,Current,2025-03-28,2026-03-27,35442.0,GE HealthCare,https://www.tenders.act.gov.au/contract/view?id=222352,False
H2541527,,Warehouse catalogued stock goods,Canberra Health Services,Contract,No,Current,2025-03-28,2026-03-25,26265.67,BECTON DICKINSON PTY LTD,https://www.tenders.act.gov.au/contract/view?id=222347,False
PICH0006537,PICH0006537,Suicide prevention E-Learning,Canberra Health Services,Contract,No,Current,2025-03-28,2030-03-27,200000.0,Health Education & Training Institute,https://www.tenders.act.gov.au/contract/view?id=222197,False
H2541464,,Theatres Implants exemption,Canberra Health Services,Contract,No,Current,2025-03-28,2026-03-27,33385.0,LIFEHEALTHCARE DISTRIBUTION PTY LTD,https://www.tenders.act.gov.au/contract/view?id=222351,False
PICH0007389,PICH0007389,CONSIGNMENT OF IVUS VOLCANO & PHOENIX ARTHRECTOMY CATHETERS,Canberra Health Services,Contract,No,Current,2025-03-27,2026-03-26,50000.0,Philips Healthcare Systems,https://www.tenders.act.gov.au/contract/view?id=222182,False
H2541375,,Non-stock product for Pathology,Canberra Health Services,Contract,No,Current,2025-03-27,2026-03-26,26400.0,Integrated Sciences,https://www.tenders.act.gov.au/contract/view?id=222354,False
PIED0008382,PIED0008382,sickbay at Ainslie School,Education Directorate,Contract,Yes,Current,2025-03-27,2026-04-30,82604.0,Aris Building Services Pty Ltd,https://www.tenders.act.gov.au/contract/view?id=225173,False
PIEP0007446.02,PIEP0007446,PIEP0007446.02 Namadgi National Park Roads and Crossings Rock Supply and Delivery (Wee Jasper Stone 50K),"Environment, Planning and Sustainable Development Directorate",Contract,Yes,Current,2025-03-26,2026-06-30,100000.0,Wee Jasper Bluestone,https://www.tenders.act.gov.au/contract/view?id=222272,False
PICH0008878,PICH0008878,FRONTIER V6 COMPACT POWERED WHEELCHAIR,Canberra Health Services,Contract,No,Current,2025-03-26,2026-03-25,24358.0,ASTRIS-PME PTY LTD,https://www.tenders.act.gov.au/contract/view?id=222339,False
PIEP0008218,PIEP0008218,ACT Greenhouse Gas Inventory,"Environment, Planning and Sustainable Development Directorate",Contract,No,Current,2025-02-26,2027-12-12,154025.3,Strategy. Policy. Research.,https://www.tenders.act.gov.au/contract/view?id=222185,False
PIED0003689,PIED0003689,STUDENT DEMAND MODELLING SERVICES FOR ACT PUBLIC SCHOOLS,Education Directorate,Contract,No,Current,2025-03-26,2028-03-26,495309.0,The Centre for International Economics,https://www.tenders.act.gov.au/contract/view?id=222612,False
H2541083,,Warehouse Catalogued Line Items,Canberra Health Services,Contract,No,Current,2025-03-26,2026-03-25,41292.24,KCI MEDICAL AUSTRALIA PTY LTD,https://www.tenders.act.gov.au/contract/view?id=222336,False
H2541245,,Warehouse catalogued stock goods,Canberra Health Services,Contract,No,Current,2025-03-26,2026-03-25,153114.85,BD,https://www.tenders.act.gov.au/contract/view?id=222340,False
PIEP0007446.01,PIEP0007446,PIEP0007446.01 Namadgi National Park Roads and Crossings Rock Supply and Delivery (Beashel Quarries 50K),"Environment, Planning and Sustainable Development Directorate",Contract,Yes,Current,2025-03-26,2026-06-30,50000.0,Beashel Quarries,https://www.tenders.act.gov.au/contract/view?id=222170,False
PIEP0007446.04,PIEP0007446,PIEP0007446.04 Namadgi National Park Roads and Crossings Rock Supply and Delivery (Heidelberg Materials 50K),"Environment, Planning and Sustainable Development Directorate",Contract,Yes,Current,2025-03-26,2026-06-30,50000.0,Heidelberg Materials,https://www.tenders.act.gov.au/contract/view?id=222172,False
PISL0007891,PISL0007891,Design and Feasibility Investigation - Various Sites,Suburban Land Agency,Contract,Yes,Current,2025-03-25,2026-03-25,348260.0,Atlas Urban Economics Pty Ltd,https://www.tenders.act.gov.au/contract/view?id=222322,False
PICH0008741,PICH0008741,Procurement of an isolated worker duress device solution,Canberra Health Services,Contract,No,Current,2025-03-25,2026-08-31,263758.0,SafetyCulture Pty Ltd,https://www.tenders.act.gov.au/contract/view?id=222348,False
H2540729,,Warehouse Catalogued Line Items,Canberra Health Services,Contract,No,Current,2025-03-24,2026-03-23,41666.1,Paragon Care Australia,https://www.tenders.act.gov.au/contract/view?id=222335,False
H2540555,,Standing Order for Pathology at TCH,Canberra Health Services,Contract,No,Current,2025-03-21,2026-03-20,48474.69,Werfen,https://www.tenders.act.gov.au/contract/view?id=222124,False
H2540239,,Non-stock items,Canberra Health Services,Contract,No,Current,2025-03-20,2026-03-19,28757.3,Boston Scientific Pty Ltd,https://www.tenders.act.gov.au/contract/view?id=222123,False
HM-19700-HPP,PICM0006038,ComCen Computers for ESA,"Chief Minister, Treasury and Economic Development Directorate",Contract,No,Current,2025-03-20,2030-03-20,158830.02,HP PPS Australia Pty Ltd,https://www.tenders.act.gov.au/contract/view?id=222024,False
