contract_number,procurement_unique_id,title,directorate,contract_type,slj_initiative,status,execution_date,expiry_date,amount,suppliers,details_url,has_attachments
H2690082,PICH0007135,High value custom made or patient specific surgical implants,Canberra Health Services,Contract,No,Current,2025-10-24,2026-09-23,26699.94,Cook Medical Australia Pty Ltd,https://www.tenders.act.gov.au/contract/view?id=227341,False
PISL0009711,PISL0009711,Callum Offices Conservation Management Plan,Suburban Land Agency,Contract,No,Current,2025-09-23,2026-09-23,207460.0,Philip Leeson Architects,https://www.tenders.act.gov.au/contract/view?id=227304,False
PICE0010175,PICE0010175,Cost benefit analysis of ACT climate action,"Environment, Planning and Sustainable Development Directorate",Contract,No,Current,2025-09-23,2026-01-23,164000.0,Deloitte Touche Tohmatsu Limited,https://www.tenders.act.gov.au/contract/view?id=226615,False
H2613864,,Warehouse Catalogued Line Items,Canberra Health Services,Contract,No,Current,2025-09-23,2026-09-22,54048.29,Paragon Care Australia,https://www.tenders.act.gov.au/contract/view?id=226889,False
H2613753,PICH0008762,Reusable Medical Devices,Canberra Health Services,Contract,No,Current,2025-09-23,2026-09-22,27464.8,C.R.Kennedy & Co Pty Ltd,https://www.tenders.act.gov.au/contract/view?id=226888,False
PITC0007678,PITC0007678,Loose Furniture and Fittings for CMP Memorial Hall,Transport Canberra and City Services,Contract,No,Current,2025-09-23,2026-03-06,98032.0,designcraft,https://www.tenders.act.gov.au/contract/view?id=226754,False
PICH0009735,PICH0009735,NCH SPOK Messenger Migration,Canberra Health Services,Contract,No,Current,2025-09-22,2026-02-21,61386.3,Progility Technologies,https://www.tenders.act.gov.au/contract/view?id=226495,False
PITC0007814,PITC0007814,Pavement Management System 2025,Transport Canberra and City Services,Contract,No,Current,2025-09-22,2028-09-30,508864.82,National Transport Research Organisation,https://www.tenders.act.gov.au/contract/view?id=226515,False
H2613467,,Warehouse Catalogued Line Items,Canberra Health Services,Contract,No,Current,2025-09-22,2026-09-21,30593.54,Paragon Care Australia,https://www.tenders.act.gov.au/contract/view?id=226885,False
PITC0006135.02,PITC0006135,Pavement Resurfacing Surveillance,Transport Canberra and City Services,Contract,No,Current,2025-09-22,2027-09-21,68000.0,Black Mountain Construction Assurance Pty Ltd,https://www.tenders.act.gov.au/contract/view?id=226714,False
H2613463,PICH0008762,Reusable Medical Devices for North Canberra Hospital,Canberra Health Services,Contract,No,Current,2025-09-22,2026-09-21,45647.58,Stryker Australia Pty Ltd,https://www.tenders.act.gov.au/contract/view?id=226883,False
H2613669,PICH0010609,LICENSE AOS PRO ENTITLEMENT & PRODUCTION 24/7 SYSTEM SUPPORT BUNDLE,Canberra Health Services,Contract,No,Current,2025-09-22,2026-08-21,61680.66,COUNTERPARTS TECHNOLOGY PTY LTD,https://www.tenders.act.gov.au/contract/view?id=226918,False
PICM0008661,PICM0008661,Employment Pathway Program 2025-2026,"Chief Minister, Treasury and Economic Development Directorate",Contract,No,Current,2025-09-22,2026-12-31,47432.0,1300apprentice,https://www.tenders.act.gov.au/contract/view?id=228362,False
SLA2395,PISL0009750,Detailed regulated and mature tree survey for Southern Gateway,Suburban Land Agency,Contract,No,Current,2025-09-22,2026-03-27,63195.0,Mrs MELINDA MYLEK,https://www.tenders.act.gov.au/contract/view?id=226516,False
H2613616,,Warehouse Catalogued Line Items,Canberra Health Services,Contract,No,Current,2025-09-22,2026-09-21,29272.65,B. Braun Australia Pty Ltd,https://www.tenders.act.gov.au/contract/view?id=226886,False
H2613450,,Non-Stock products for OT TCH,Canberra Health Services,Contract,No,Current,2025-09-22,2026-09-21,34752.96,Medtronic Australasia Pty Ltd,https://www.tenders.act.gov.au/contract/view?id=226882,False
PIED0009360,PIED0009360,Gilmore Primary School - 81700 - FY2025/26,Education Directorate,Contract,Yes,Current,2025-09-19,2026-11-30,109929.0,Canberra Build,https://www.tenders.act.gov.au/contract/view?id=226428,False
PIIN0010020,PIIN0010020,Office Cleaning Services,ACT Integrity Commission,Contract,Yes,Current,2025-09-22,2028-09-30,56203.78,Spec Indigenous Pty Ltd,https://www.tenders.act.gov.au/contract/view?id=226444,False
H2613303,,Warehouse Catalogued Line Items,Canberra Health Services,Contract,No,Current,2025-09-19,2026-09-18,68583.24,Baxter Healthcare,https://www.tenders.act.gov.au/contract/view?id=226653,False
PICI0008019.b,PICI0008019,TM1 Maintenance and Support: Activity Based Cost Model (ABC),Canberra Institute of Technology,Contract,No,Current,2025-09-18,2028-09-17,160000.0,KPMG AUSTRALIA TECHNOLOGY SOLUTIONS PTY LIMITED,https://www.tenders.act.gov.au/contract/view?id=227122,False
PICM0003809,PICM0003809,RECEIPTING AND PAYMENT SYSTEM,"Chief Minister, Treasury and Economic Development Directorate",Contract,No,Current,2025-09-17,2028-09-17,1640290.0,READYTECH HOLDINGS LTD,https://www.tenders.act.gov.au/contract/view?id=226713,False
CLR-N2300-PANEL.104,,Canberra Light Rail Specialist Advisors Panel -,ACT Government,"Panel Contract
(CLR-N2300-PANEL)",No,Current,2025-09-18,2027-07-29,0.0,AJV Infrastructure Pty Ltd,https://www.tenders.act.gov.au/contract/view?id=226405,False
PIHD0009394,PIHD0009394,Health ID Card Printing Support,"Chief Minister, Treasury and Economic Development Directorate",Contract,No,Current,2025-09-17,2026-09-16,55183.69,Cardserv ID Pty Ltd,https://www.tenders.act.gov.au/contract/view?id=227092,False
PIED0007361,PIED0007361,Richardson Primary School - 81700 - FY24/25,Education Directorate,Contract,Yes,Current,2025-09-17,2027-01-31,256184.5,The Playground People,https://www.tenders.act.gov.au/contract/view?id=226440,False
H2612958,,Warehouse Catalogued Line Items,Canberra Health Services,Contract,No,Current,2025-09-17,2026-09-16,35442.0,GE HealthCare,https://www.tenders.act.gov.au/contract/view?id=226652,False
2025.PICS0008960,PICS0008960,Evaluation of the ACT Women's Plan 2016-2026,Health and Community Services Directorate,Contract,No,Current,2025-09-17,2026-09-16,53239.31,Impact Collaborative Pty Ltd,https://www.tenders.act.gov.au/contract/view?id=226979,False
PIED0009285,PIED0009285,Bonython Primary School - Accessible Bathroom - 81700 - FY2025/26,Education Directorate,Contract,Yes,Current,2025-09-17,2026-11-30,106594.89,ACT Building and Maintenance Pty Ltd,https://www.tenders.act.gov.au/contract/view?id=226418,False
H2612577,,Warehouse Catalogued Line Items,Canberra Health Services,Contract,No,Current,2025-09-16,2026-09-15,113889.6,Haines Medical Australia Pty Ltd,https://www.tenders.act.gov.au/contract/view?id=226636,False
PIJC0009847,PIJC0009847,Provision of the Total Apparel Management System for ACT Fire & Rescue,Justice and Community Safety Directorate,Contract,Yes,Current,2025-10-28,2028-09-15,640000.0,LHD Group Australia Pty Ltd,https://www.tenders.act.gov.au/contract/view?id=227426,False
H2612698,,Warehouse Catalogued Line Items,Canberra Health Services,Contract,No,Current,2025-09-16,2026-09-15,5181.12,Multigate Medical Products Pty Ltd,https://www.tenders.act.gov.au/contract/view?id=226649,False
H2612661,PICH0007135,High value custom made or patient specific surgical implants,Canberra Health Services,Contract,No,Current,2025-09-16,2026-09-15,25289.83,LIFEHEALTHCARE DISTRIBUTION PTY LTD,https://www.tenders.act.gov.au/contract/view?id=226644,False
H2612460,,Reagents for Pathology at TCH,Canberra Health Services,Contract,No,Current,2025-09-15,2026-09-14,31445.48,Roche Diagnostics Australia Pty Ltd,https://www.tenders.act.gov.au/contract/view?id=226634,False
2025.PICS0008790,2025.PICS0008790,ACT Women's Return to Work Workshops,Health and Community Services Directorate,Contract,No,Current,2025-09-15,2026-10-15,43398.0,ELM (ACT),https://www.tenders.act.gov.au/contract/view?id=226773,False
PIEP0009517,PIEP0009517,ANBG Nursery - Ex Situ Tuggeranong Lignum,"Environment, Planning and Sustainable Development Directorate",Contract,Yes,Current,2025-09-15,2026-10-30,90000.0,Australian National Botanic Gardens,https://www.tenders.act.gov.au/contract/view?id=228403,False
H2612565,PICH0011028,Outdoor Furniture B5 L4,Canberra Health Services,Contract,No,Current,2025-09-15,2026-09-14,61792.5,Street Furniture Australia,https://www.tenders.act.gov.au/contract/view?id=226661,False
H2612149,,Catalogued Line Items,Canberra Health Services,Contract,No,Current,2025-09-12,2026-09-11,226221.38,Haines Medical Australia Pty Ltd,https://www.tenders.act.gov.au/contract/view?id=226517,False
H2612155,,Warehouse Catalogued Line Items,Canberra Health Services,Contract,No,Current,2025-09-12,2026-09-11,33686.4,Merit Medical Australia,https://www.tenders.act.gov.au/contract/view?id=226518,False
H2612232,,Reagents for Pathology at TCH,Canberra Health Services,Contract,No,Current,2025-09-12,2026-09-11,27104.64,Roche Diagnostics Australia Pty Ltd,https://www.tenders.act.gov.au/contract/view?id=226519,False
PICR0009910,PICR0009910,"Planning, Design and Infrastructure Advisory Services",City Renewal Authority,Contract,Yes,Current,2025-09-12,2026-06-30,466399.0,Aurecon,https://www.tenders.act.gov.au/contract/view?id=226497,False
H2612102,,Catalogued Line Items,Canberra Health Services,Contract,No,Current,2025-09-12,2026-09-11,26841.89,ITL Australia Pty Ltd,https://www.tenders.act.gov.au/contract/view?id=226512,False
PIEP0007856,PIEP0007856,ACT Groundwater Monitoring and Bore Drilling Program,"Environment, Planning and Sustainable Development Directorate",Contract,No,Current,2025-09-11,2026-03-06,213422.0,EMM Consulting Pty Limited,https://www.tenders.act.gov.au/contract/view?id=226310,False
H2611972,,Warehouse Catalogued Line Items,Canberra Health Services,Contract,No,Current,2025-09-11,2026-09-10,26963.2,Fresenius Kabi,https://www.tenders.act.gov.au/contract/view?id=226508,False
PIED0009414,PIED0009414,Lanyon High School - Accessible Food Technology Cooking Station - 81700 - FY2025/26,Education Directorate,Contract,Yes,Current,2025-09-11,2026-11-06,64713.0,Canberra Build,https://www.tenders.act.gov.au/contract/view?id=226329,False
H2611842,,Non-Stock Products for CCL TCH,Canberra Health Services,Contract,No,Current,2025-09-10,2026-09-09,26292.2,Zimmer Biomet,https://www.tenders.act.gov.au/contract/view?id=226500,False
H2611669,,Catalogued Line Items for OT,Canberra Health Services,Contract,No,Current,2025-09-10,2026-09-09,25802.7,Medtronic Australasia Pty Ltd,https://www.tenders.act.gov.au/contract/view?id=226493,False
PITC0008085,PITC0008085,Irrigation Control System,Transport Canberra and City Services,Contract,No,Current,2025-09-10,2028-09-09,132745.8,Rain Bird Australia,https://www.tenders.act.gov.au/contract/view?id=226319,False
H2611732,,4PLEX PLUS (COV-2/FLU/RSV,Canberra Health Services,Contract,No,Current,2025-09-10,2026-09-09,29771.5,Cepheid Holdings Pty Ltd,https://www.tenders.act.gov.au/contract/view?id=226494,False
PIEP0010135,PIEP0010135,Expansion of Canberra Grassland Earless Dragon Colony,City and Environment Directorate,Contract,No,Current,2025-09-09,2029-06-30,1997585.96,Zoological Parks and Gardens T/A Melbourne Zoo,https://www.tenders.act.gov.au/contract/view?id=226249,False
H2611464,,Warehouse Catalogued Line Items,Canberra Health Services,Contract,No,Current,2025-09-09,2026-09-08,27426.01,Multigate Medical Products Pty Ltd,https://www.tenders.act.gov.au/contract/view?id=226490,False
H2611447,,Catalogued Line Items for OT,Canberra Health Services,Contract,No,Current,2025-09-09,2026-09-08,33131.67,Medtronic Australasia Pty Ltd,https://www.tenders.act.gov.au/contract/view?id=226430,False
PITC0003759.2,PITC0003759,Mowing Services Panel,Infrastructure Canberra,"Panel Contract
(PITC0003759)",Yes,Current,2025-08-12,2030-08-31,0.0,BURGESS HORTICULTURAL SERVICES (BURHOR),https://www.tenders.act.gov.au/contract/view?id=226258,False
PICH0006654,PICH0006654,Hi Lo Recliner Chairs,Canberra Health Services,Contract,No,Current,2025-09-09,2026-09-08,84864.5,Unicare Health,https://www.tenders.act.gov.au/contract/view?id=226492,False
PIEP0010135,PIEP0010135,Canberra Grassland Earless Dragon Melbourne Zoo,"Environment, Planning and Sustainable Development Directorate",Contract,No,Current,2025-09-09,2029-06-30,1997585.96,Zoological Parks and Gardens Board trading as Melbourne Zoo,https://www.tenders.act.gov.au/contract/view?id=226272,False
CLR-N2300-PANEL.096,,Canberra Light Rail Specialist Advisors Panel -,ACT Government,"Panel Contract
(CLR-N2300-PANEL)",No,Current,2025-09-09,2027-07-29,0.0,Tagg Advisory Services,https://www.tenders.act.gov.au/contract/view?id=226251,False
H2611452,,Warehouse Catalogued Line Items,Canberra Health Services,Contract,No,Current,2025-09-09,2026-09-08,38248.5,Paragon Care Australia,https://www.tenders.act.gov.au/contract/view?id=226431,False
H2611586,,Warehouse Catalogued Line Items,Canberra Health Services,Contract,No,Current,2025-09-09,2026-09-08,34020.14,BD,https://www.tenders.act.gov.au/contract/view?id=226491,False
2025.4097.210,PICS0004097,Central Intake Service,Community Services Directorate,Contract,Yes,Current,2025-09-09,2028-11-30,8901466.49,The Salvation Army (NSW) Property Trust,https://www.tenders.act.gov.au/contract/view?id=227031,False
PIEP0009416,PIEP0009416,Remediation Auditor Services - Section 76 watson,"Environment, Planning and Sustainable Development Directorate",Contract,No,Current,2025-09-08,2026-03-09,27453.25,Geosyntec Consultants Pty Ltd,https://www.tenders.act.gov.au/contract/view?id=226273,False
H2690011,,Non-Stock Products for CCL TCH,Canberra Health Services,Contract,No,Current,2025-09-08,2026-09-07,36947.46,Cook Medical Australia Pty Ltd,https://www.tenders.act.gov.au/contract/view?id=226498,False
PIEP0003720,PIEP0003720,"Namadgi National Park Heritage Huts – Historic Huts, Assessments & CMPs","Environment, Planning and Sustainable Development Directorate",Contract,No,Current,2025-09-02,2026-03-31,83589.0,Philip Leeson Architects,https://www.tenders.act.gov.au/contract/view?id=226204,False
H2611420,,Catalogued Line Items for Pathology TCH,Canberra Health Services,Contract,No,Current,2025-09-08,2026-09-07,26636.5,BD,https://www.tenders.act.gov.au/contract/view?id=226427,False
PIEP0009905,PIEP0009905,Finalisation of Eastern Broadacre Strategic Assessment,City and Environment Directorate,Contract,Yes,Current,2025-09-19,2027-09-05,2327728.7,Open Lines Consulting,https://www.tenders.act.gov.au/contract/view?id=226244,False
H2610848,,Warehouse Catalogued Line Items,Canberra Health Services,Contract,No,Current,2025-09-05,2026-09-04,7823332.0,Haines Medical Australia Pty Ltd,https://www.tenders.act.gov.au/contract/view?id=226359,False
H2610845,,Warehouse Catalogued Line Items,Canberra Health Services,Contract,No,Current,2025-09-05,2026-09-04,11599.0,Haines Medical Australia Pty Ltd,https://www.tenders.act.gov.au/contract/view?id=226358,False
H2611092,,Warehouse Catalogued Line Items,Canberra Health Services,Contract,No,Current,2025-09-05,2026-09-04,25686.0,Fisher & Paykel Healthcare,https://www.tenders.act.gov.au/contract/view?id=226361,False
H2610896,,Warehouse Catalogued Line Items,Canberra Health Services,Contract,No,Current,2025-09-04,2026-09-03,30987.88,Paragon Care Australia,https://www.tenders.act.gov.au/contract/view?id=226360,False
H2610587,,Catalogued Line Items for Pathology TCH,Canberra Health Services,Contract,No,Current,2025-09-03,2026-09-02,29562.76,bioMerieux Australia Pty Ltd,https://www.tenders.act.gov.au/contract/view?id=226335,False
H2610727,,Catalogued Line Items for Pathology NCH,Canberra Health Services,Contract,No,Current,2025-09-03,2026-09-02,30048.7,Werfen,https://www.tenders.act.gov.au/contract/view?id=226336,False
CLD49744,,Provision of Equipment and Operators for Wood Yard Services,Transport Canberra and City Services,Contract,Yes,Current,2025-09-03,2026-06-30,38000.0,NOWASTE WOOD BUSTERS,https://www.tenders.act.gov.au/contract/view?id=226762,False
CLR-N2300-PANEL.083,,Canberra Light Rail Specialist Advisors Panel -,ACT Government,"Panel Contract
(CLR-N2300-PANEL)",No,Current,2025-09-03,2027-07-29,0.0,Umwelt (Australia) Pty Limited,https://www.tenders.act.gov.au/contract/view?id=226188,False
PICI0009443,PICI0009443,EV Roadshow Trailer,Canberra Institute of Technology,Contract,No,Current,2025-09-03,2026-03-02,76269.52,Egritech Pty Ltd,https://www.tenders.act.gov.au/contract/view?id=226437,False
PITC0011152,PITC0011152,RSPCA Funding Agreement 2025/2026,Territory and Municipal Services Directorate,Contract,No,Current,2025-09-03,2026-06-30,962638.6,THE ROYAL SOCIETY FOR THE PREVENTION OF CRUELTY TO ANIMALS ACT INC,https://www.tenders.act.gov.au/contract/view?id=227025,False
HM-23140-ASI,PIED0009553,IFPs for Garran Primary School Modernisation,"Chief Minister, Treasury and Economic Development Directorate",Contract,No,Current,2025-09-03,2030-09-02,251713.0,ASI Solutions,https://www.tenders.act.gov.au/contract/view?id=226191,False
58207-NCT-8201,PIMA0008201,COST ESTIMATION SERVICES FOR LIGHT RAIL STAGE 2,Infrastructure Canberra,Contract,Yes,Current,2025-09-02,2027-08-31,1072684.8,WTP Australia Pty Ltd,https://www.tenders.act.gov.au/contract/view?id=226250,False
H2610294,,Catalogued Line Items for OT,Canberra Health Services,Contract,No,Current,2025-09-02,2026-09-01,30977.1,Boston Scientific Pty Ltd,https://www.tenders.act.gov.au/contract/view?id=226334,False
RITM5281805,PICM0008721,Generator Maintenance and Ad Hoc Break Fix Services,"Chief Minister, Treasury and Economic Development Directorate",Contract,Yes,Current,2025-08-29,2030-08-31,499780.83,Generator Power (Australia) Pty Ltd,https://www.tenders.act.gov.au/contract/view?id=226090,False
H2610168,,Stock Catalogued Items,Canberra Health Services,Contract,No,Current,2025-09-01,2026-08-31,40654.9,B. Braun Australia Pty Ltd,https://www.tenders.act.gov.au/contract/view?id=226331,False
PITC0003759.10,PITC0003759,Mowing Services Panel,Infrastructure Canberra,"Panel Contract
(PITC0003759)",Yes,Current,2025-08-12,2030-08-31,0.0,Weekley Property Services,https://www.tenders.act.gov.au/contract/view?id=226267,False
H2610223,,Catalogued Line Items,Canberra Health Services,Contract,No,Current,2025-09-01,2026-08-31,25696.0,Paragon Care Australia,https://www.tenders.act.gov.au/contract/view?id=226332,False
PITC0003759.4,PITC0003759,Mowing Services Panel,Infrastructure Canberra,"Panel Contract
(PITC0003759)",Yes,Current,2025-08-12,2030-08-31,0.0,Marsupial Landscape Management Pty Limited,https://www.tenders.act.gov.au/contract/view?id=226261,False
PIJC0006046,PIJC0006046,Sublicence in relation to the use of Communications Facility,ACT Government,Contract,No,Current,2025-10-31,2030-08-30,88898.0,Icon Water Limited,https://www.tenders.act.gov.au/contract/view?id=227563,False
PIJC0005131,PIJC0005131,Supply and Transport of Vehicles used for ACT Fire & Rescue RCR Training,ACT Government,Contract,No,Current,2025-09-01,2028-08-31,240000.0,Access Trading Company Pty Limited,https://www.tenders.act.gov.au/contract/view?id=226150,False
PICI0005172,PICI0005172,Learning Resources for CIT Hairdressing and Beauty Therapy,Canberra Institute of Technology,Contract,No,Current,2025-09-01,2028-08-31,153037.5,The Trustee for Barrett Discretionary Trust,https://www.tenders.act.gov.au/contract/view?id=226219,False
PO-0519,PIED0009304,Pear Deck Subscription with LMS Access,Education Directorate,Contract,No,Current,2025-07-11,2026-08-31,38256.53,GoGuardian,https://www.tenders.act.gov.au/contract/view?id=224500,False
PITC0003759.1,PITC0003759,Mowing Services Panel,Infrastructure Canberra,"Panel Contract
(PITC0003759)",Yes,Current,2025-08-12,2030-08-31,0.0,18fifty3 Group Pty Ltd,https://www.tenders.act.gov.au/contract/view?id=226256,False
PIEP0009929.02,PIEP0009929.02,Targeted Species Surveys - Belconnen Town Centre and Surrounds Change Areas,"Environment, Planning and Sustainable Development Directorate",Contract,No,Current,2025-09-01,2026-09-01,78315.6,Capital Ecology,https://www.tenders.act.gov.au/contract/view?id=226189,False
PITC0003759,PITC0003759,Mowing Services Panel,Infrastructure Canberra,Panel,Yes,Current,2025-08-12,2030-08-31,0.0,"18fifty3 Group Pty Ltd (PITC0003759.1)
BURGESS HORTICULTURAL SERVICES (BURHOR) (PITC0003759.2)
Canberra Mowing (PITC0003759.3)
MBS FM Pty Ltd (PITC0003759.5)
Marsupial Landscape Management Pty Limited (PITC0003759.4)
ProBlade (PITC0003759.6)
Summit Open Space Services (PITC0003759.8)
Walsh & Co Contracting (PITC0003759.9)",https://www.tenders.act.gov.au/contract/view?id=226253,False
PICM0006102,PICM0006102,Leasing Opportunity at University of Canberra Stromlo Forest Park (UC Stromlo),"Chief Minister, Treasury and Economic Development Directorate",Contract,No,Current,2025-08-25,2030-08-31,189004.0,Handlebar Stromlo,https://www.tenders.act.gov.au/contract/view?id=225989,False
PITC0003759.9,PITC0003759,Mowing Services Panel,Infrastructure Canberra,"Panel Contract
(PITC0003759)",Yes,Current,2025-08-25,2030-08-31,0.0,Walsh & Co Contracting,https://www.tenders.act.gov.au/contract/view?id=226266,False
PICS0009278,PICS0009278,Rectification and Refurbishment of a Dual Occupancy Development in Chifley,Community Services Directorate,Contract,Yes,Current,2025-09-01,2026-02-16,504266.0,Blueprint Projects (ACT) Pty Limited,https://www.tenders.act.gov.au/contract/view?id=226385,False
JaCSSSA2025-26,PIJC0010507,LNAU Agreement-Research Services Order Form -JaCS SSA 2025-26,Justice and Community Safety Directorate,Contract,No,Current,2025-09-01,2026-08-31,126308.37,RELX Trading Australia Pty Limited,https://www.tenders.act.gov.au/contract/view?id=227072,False
PICI0007986,PICI0007986,Strategic Asset Management Consultancy Service,Canberra Institute of Technology,Contract,No,Current,2025-08-29,2026-04-28,145376.0,SAFM Solutions,https://www.tenders.act.gov.au/contract/view?id=227126,False
PITC0009635,PITC0009635,Installation of Tree Surrounds,Transport Canberra and City Services,Contract,Yes,Current,2025-08-28,2026-08-27,300000.0,Collective Civil,https://www.tenders.act.gov.au/contract/view?id=226156,False
PIEP0005462,PIEP0005462,Inner North & City District Infrastructure Capacity Study,"Environment, Planning and Sustainable Development Directorate",Contract,No,Current,2025-08-28,2026-09-27,178310.0,SMEC Australia,https://www.tenders.act.gov.au/contract/view?id=226144,False
PICI0009528,PICI0009528,Integrated Waste Scales,Canberra Institute of Technology,Contract,No,Current,2025-08-28,2028-08-27,79508.0,Waste Check Technologies Pty Ltd,https://www.tenders.act.gov.au/contract/view?id=227130,False
PICM0009596,PICM0009596,Floriade Planter Box Transportation and Install 2025-2028,"Chief Minister, Treasury and Economic Development Directorate",Contract,Yes,Current,2025-08-27,2026-11-30,209428.92,Barlens Event hire,https://www.tenders.act.gov.au/contract/view?id=226030,False
PO_08328,PIED0007537,Charnwood Dunlop School Carpet Upgrade,Education Directorate,Contract,Yes,Current,2025-08-27,2026-08-26,53450.0,Solomon's Flooring Belconnen,https://www.tenders.act.gov.au/contract/view?id=226153,False
CPQ-3838058-1,PICM0007916,Oracle Java Licensing and Support,"Chief Minister, Treasury and Economic Development Directorate",Contract,No,Current,2025-06-19,2026-08-26,278051.4,Oracle Corporation,https://www.tenders.act.gov.au/contract/view?id=224260,False
PICR0009853,PICR0009853,Quantity Surveyor Services,City Renewal Authority,Contract,No,Current,2025-08-26,2026-06-30,160780.0,WTP AUSTRALIA PTY LIMITED,https://www.tenders.act.gov.au/contract/view?id=226203,False
PISL0010296,PISL0010296,North Wright Compact Housing Stage 2 - Building Certifier,Suburban Land Agency,Contract,No,Current,2025-08-21,2027-08-20,55000.0,Absolute Approvals,https://www.tenders.act.gov.au/contract/view?id=226127,False
CLR-N2300-PANEL.101,,Canberra Light Rail Specialist Advisors Panel -,ACT Government,"Panel Contract
(CLR-N2300-PANEL)",No,Current,2025-08-25,2027-07-29,0.0,Projects Assured,https://www.tenders.act.gov.au/contract/view?id=226307,False
GS3927956,GS3927956,CRA FLOWER PLANTER PROGRAM,City Renewal Authority,Contract,Yes,Current,2025-08-25,2028-10-26,1157945.53,Citywide,https://www.tenders.act.gov.au/contract/view?id=227203,False
PICE0010157,PICE0010157,LACT2528-F Newspaper Subscriptions,Transport Canberra and City Services,Contract,No,Current,2025-08-22,2028-08-21,273575.0,Prenax Pty Ltd,https://www.tenders.act.gov.au/contract/view?id=226242,False
PICM0009788,PICM0009788,Procurement of Australian Standards subscription,"Chief Minister, Treasury and Economic Development Directorate",Contract,No,Current,2025-08-22,2026-06-30,31971.8,Standards Australia Limited,https://www.tenders.act.gov.au/contract/view?id=226140,False
CLR-N2300-PANEL.099,,Canberra Light Rail Specialist Advisors Panel -,ACT Government,"Panel Contract
(CLR-N2300-PANEL)",No,Current,2025-08-22,2027-07-29,0.0,Barmco Mana McMurray,https://www.tenders.act.gov.au/contract/view?id=226118,False
H2608734,,Rapid Antigen Tests 4PLEX PLUS (COV-2/FLU/RSV,Canberra Health Services,Contract,No,Current,2025-08-22,2026-08-21,82571.5,Cepheid Holdings Pty Ltd,https://www.tenders.act.gov.au/contract/view?id=226022,False
H2608560,,Warehouse Catalogued Line Items,Canberra Health Services,Contract,No,Current,2025-08-21,2026-08-20,33109.6,Haines Medical Australia Pty Ltd,https://www.tenders.act.gov.au/contract/view?id=226021,False
PICR0009775,PICR0009775,BUSINESS CASE AND COMMERCIAL ADVISORY SERVICES,City Renewal Authority,Contract,Yes,Current,2025-08-21,2026-06-30,975000.0,Lockbridge Pty Ltd,https://www.tenders.act.gov.au/contract/view?id=226226,False
PIJC0007994,PIJC0007994,Procurement of a Panel to conduct the Independent Inquiry into the future of the ACT clubs industry,ACT Government,Contract,No,Current,2025-08-21,2026-05-22,470120.0,Synergy Group Australia Pty Ltd,https://www.tenders.act.gov.au/contract/view?id=226006,False
